GeneName	Biotype	Position	NR:Seq-id	NR:Score	NR:Evalue	NR:Description	NT:Seq-id	NT:Score	NT:Evalue	NT:Description	Uniprot:UniProtKB-AC	Uniprot:Score	Uniprot:Evalue	Uniprot:Description	COG:gene	COG:Score	COG:Eval	COG:num	Pfam:pfam_ID	Pfam:pfam_Name	Pfam:pfam_Description	GO:biological_process	GO:cellular_component	GO:molecular_function	KEGG:KO	KEGG:Description	Lbra1	Lbra2	Lbra3	Lbra4	Lbra5	Lbra6	Llun1	Llun2	Llun3	Llun4	Llun5	Llun6	LMbra1	LMbra2	LMbra3	LMbra4	LMbra5	LMbra6	LMlun1	LMlun2	LMlun3	LMlun4	LMlun5	LMlun6	Mbra1	Mbra2	Mbra3	Mbra4	Mbra5	Mbra6	Mlun1	Mlun2	Mlun3	Mlun4	Mlun5	Mlun6	MLbra1	MLbra2	MLbra3	MLbra4	MLbra5	MLbra6	MLlun1	MLlun2	MLlun3	MLlun4	MLlun5	MLlun6
adamtsl5	protein_coding	chrNC_030679.1:97653859-97689336:+	gi|301605335|ref|XP_002932288.1|	2766	0	PREDICTED: ADAMTS-like protein 5 [Xenopus tropicalis]	gi|847111877|ref|XM_002932242.3|	2955	0	PREDICTED: Xenopus (Silurana) tropicalis ADAMTS-like 5 (adamtsl5), mRNA	Q6ZMM2	345	7.00E-106	ADAMTS-like protein 5	.	.	.	.	pfam05986	ADAM_spacer1	ADAM-TS Spacer 1. This family represents the Spacer-1 region from the ADAM-TS family of metalloproteinases.	.	GO:0005576|extracellular region;GO:0001527|microfibril;GO:0005578|proteinaceous extracellular matrix;	GO:0008201|heparin binding;GO:0004222|metalloendopeptidase activity;GO:0008270|zinc ion binding;	.	.	2.750745603	3.601917786	3.117472142	4.037148332	2.745885461	3.298851179	36.89876329	29.37916913	53.85541696	51.82630562	41.5181112	19.24021084	2.635358652	3.380359562	2.114680576	2.573444473	2.015927245	2.140213417	61.61381839	108.0191556	56.92776795	79.45925515	66.67741258	62.70124554	1.519767918	2.18738289	1.255630972	2.473745188	2.862434487	2.632028502	107.2375139	68.17392838	62.76672312	102.2973091	80.60261078	108.7627034	2.316443229	2.805951557	2.619980178	2.869027198	2.176677381	2.689764615	61.549144	45.14210489	55.34935363	42.0668619	63.61157689	51.00959774
tf	protein_coding	chrNC_030681.1:126324097-126345250:+	gi|73853808|ref|NP_001027487.1|	3678	0	serotransferrin precursor [Xenopus tropicalis]	gi|73853807|ref|NM_001032316.1|	2302	0	Xenopus (Silurana) tropicalis transferrin (tf), mRNA	Q501K5	1421	0	Serotransferrin	.	.	.	.	pfam00405	Transferrin	Transferrin.	GO:0006811|ion transport;GO:0055072|iron ion homeostasis;	GO:0005615|extracellular space;	GO:0046872|metal ion binding;	K14736	TF; transferrin	611.3187192	843.8040766	581.6237289	478.4690726	258.3651263	471.4728248	6.844126636	5.614723097	2.80501251	30.09585794	8.111854902	4.982513951	372.5966287	438.3724527	144.9104635	429.3134522	101.0370914	322.2553531	13.29906385	72.10042649	4.314931195	25.53986656	9.839263529	8.81840145	36.0205032	125.9342758	50.80083705	257.3183941	423.4402523	164.3809247	24.28289092	13.08082769	12.59635911	4.881247277	314.9668786	25.5744894	361.4534586	320.3678979	358.9841869	430.2395922	58.36273202	303.3162229	11.05141021	7.974413152	6.830745638	4.067453809	5.254965556	4.739997196
sparc	protein_coding	chrNC_030679.1:11519289-11535993:-	gi|45361541|ref|NP_989347.1|	1434	0	SPARC precursor [Xenopus tropicalis]	gi|51491873|ref|NM_204016.2|	1679	0	Xenopus (Silurana) tropicalis secreted protein, acidic, cysteine-rich (osteonectin) (sparc), mRNA	P36378	516	5.00E-180	SPARC	.	.	.	.	pfam10591	SPARC_Ca_bdg	Secreted protein acidic and rich in cysteine Ca binding region. The SPARC_Ca_bdg domain of Secreted Protein Acidic and Rich in Cysteine is responsible for the anti-spreading activity of human urothelial cells. It is rich in alpha-helices. This extracellular calcium-binding domain contains two EF-hands that each coordinates one Ca2+ ion, forming a helix-loop-helix structure that not only drives the conformation of the protein but is also necessary for biological activity. The anti-spreading activity was dependent on the coordination of Ca2+ by a Glu residue at the Z position of EF-hand 2.	GO:0007165|signal transduction;	GO:0005604|basement membrane;GO:0005615|extracellular space;	GO:0005509|calcium ion binding;	.	.	321.4916048	395.3027247	367.2415604	490.8716412	318.4630525	402.8628598	2797.934413	1914.848714	1763.974046	2094.7129	2027.035273	1971.204975	398.6908263	368.8228899	415.810762	389.5481056	360.56874	412.7098762	1600.084572	1547.282753	1307.540791	879.7356575	1128.183756	1808.889985	394.6233224	370.6545773	262.0681614	390.0218784	368.5807144	399.5652309	1496.967348	1232.610587	716.7858844	1261.458693	828.9451997	1088.833635	302.9971625	393.6898772	322.6996911	388.6487317	361.1376833	321.385138	791.22832	3212.357841	1384.506841	3121.035868	2004.869863	1416.772399
spock3	protein_coding	chrNC_030677.1:41555269-41686899:+	gi|847152761|ref|XP_012823314.1|	2052	0	PREDICTED: testican-3 isoform X1 [Xenopus tropicalis]	gi|847152760|ref|XM_012967860.1|	5319	0	PREDICTED: Xenopus (Silurana) tropicalis sparc/osteonectin, cwcv and kazal-like domains proteoglycan (testican) 3 (spock3), transcript variant X1, mRNA	Q9BQ16	628	0	Testican-3	.	.	.	.	pfam10591	SPARC_Ca_bdg	Secreted protein acidic and rich in cysteine Ca binding region. The SPARC_Ca_bdg domain of Secreted Protein Acidic and Rich in Cysteine is responsible for the anti-spreading activity of human urothelial cells. It is rich in alpha-helices. This extracellular calcium-binding domain contains two EF-hands that each coordinates one Ca2+ ion, forming a helix-loop-helix structure that not only drives the conformation of the protein but is also necessary for biological activity. The anti-spreading activity was dependent on the coordination of Ca2+ by a Glu residue at the Z position of EF-hand 2.	GO:2000146|negative regulation of cell motility;GO:0010951|negative regulation of endopeptidase activity;GO:0019800|peptide cross-linking via chondroitin 4-sulfate glycosaminoglycan;GO:0007165|signal transduction;	GO:0031012|extracellular matrix;GO:0005615|extracellular space;GO:0005578|proteinaceous extracellular matrix;	GO:0005509|calcium ion binding;GO:0005539|glycosaminoglycan binding;GO:0008191|metalloendopeptidase inhibitor activity;	K08136	SPOCK; sparc/osteonectin, cwcv and kazal-like domains proteoglycan (testican)	111.4803115	86.54304821	109.5477145	82.44483542	95.54143902	95.73205422	9.274058435	0.784906802	5.779815345	3.516121605	4.639956952	0.897628884	80.25864986	93.88721227	79.53798572	90.41926175	96.68574139	80.39519632	4.691110575	7.955747054	3.167022081	1.167770323	4.595070955	0.892022042	88.95903996	89.53959869	75.10118183	70.06654193	100.7399424	73.49861041	2.636123745	4.784135325	0.575562532	3.21237638	2.069237441	1.487987144	88.32350363	84.56514449	95.34428331	104.6663626	83.16755463	84.99858804	4.359257201	1.358579925	1.993239651	4.352265698	2.969820921	2.376502005
pnoc	protein_coding	chrNW_016683402.1:654827-703652:+	gi|163915097|ref|NP_001106534.1|	1210	4.00E-163	prepronociceptin precursor [Xenopus tropicalis]	gi|163915096|ref|NM_001113063.1|	1326	0	Xenopus (Silurana) tropicalis prepronociceptin (pnoc), mRNA	Q13519	89.7	2.00E-19	Prepronociceptin	.	.	.	.	pfam01160	Opiods_neuropep	Vertebrate endogenous opioids neuropeptide.	GO:0007268|chemical synaptic transmission;GO:0007565|female pregnancy;GO:0007218|neuropeptide signaling pathway;GO:0007600|sensory perception;GO:0007165|signal transduction;	GO:0043679|axon terminus;GO:0030425|dendrite;GO:0005576|extracellular region;GO:0043025|neuronal cell body;GO:0005886|plasma membrane;	GO:0005184|neuropeptide hormone activity;GO:0031628|opioid receptor binding;	.	.	38.39076973	37.70209776	38.59615459	37.38876334	39.79904996	34.97821431	1.037294253	3.148506245	2.456365618	0.310471166	1.569713398	0.372483073	33.8299298	43.14017515	47.62713846	42.19609202	44.92507549	39.53165259	0.234632284	0.443235908	0.35045281	0.139137367	0.348600743	0.045293404	45.697435	38.72343902	36.72614062	42.99951194	42.3285675	46.68157128	0.187987829	0.36553639	0.740545987	0.087361658	0.139893664	0.321395901	38.37567032	40.51997195	39.30044984	36.28022713	44.36519797	34.59340742	0.134166304	0.966880173	0.539022914	5.5450669	0.885715907	1.528859962
dcn	protein_coding	chrNC_030679.1:46045982-46203793:-	gi|154147680|ref|NP_001093704.1|	1756	0	decorin precursor [Xenopus tropicalis]	gi|847107955|ref|XM_012958377.1|	2934	0	PREDICTED: Xenopus (Silurana) tropicalis decorin (dcn), transcript variant X2, mRNA	Q9DE68	533	2.00E-180	Decorin	alr0124_1	60.8	1.00E-08	COG4886	pfam13855	LRR_8	Leucine rich repeat.	.	GO:0005578|proteinaceous extracellular matrix;	.	K04660	DCN; decorin	2.135312991	3.279342834	4.357417319	5.872213469	2.515217464	3.252691675	399.4261036	189.2468867	236.7016491	212.0043463	241.7685339	164.2122303	5.087303644	3.923379435	2.101891125	4.139582704	2.658262593	2.921787074	262.5348481	133.9064315	235.9154132	116.6302376	196.4109623	211.6774458	3.026304076	3.726380784	2.628918269	3.757681052	3.577269299	3.706050082	186.9345786	180.598545	110.9414101	212.8489899	113.2966092	124.3863619	2.582252035	3.762828007	3.529248307	4.746724196	1.97142315	2.526450311	169.0626025	309.1039296	188.3053828	306.5370747	252.8036368	211.8684277
c1ql1	protein_coding	chrNC_030686.1:6561657-6590110:-	gi|313760697|ref|NP_001186529.1|	678	4.00E-82	C1q-related factor precursor [Xenopus tropicalis]	gi|313760696|ref|NM_001199600.1|	1319	0	Xenopus (Silurana) tropicalis complement component 1, q subcomponent-like 1 (c1ql1), mRNA	O88992	191	4.00E-55	C1q-related factor	.	.	.	.	pfam00386	C1q	C1q domain. C1q is a subunit of the C1 enzyme complex that activates the serum complement system.	GO:0099558|maintenance of synapse structure;GO:0061743|motor learning;GO:0016322|neuron remodeling;	GO:0044301|climbing fiber;GO:0005581|collagen trimer;GO:0005737|cytoplasm;GO:0098793|presynapse;GO:0043083|synaptic cleft;	GO:0005102|receptor binding;	.	.	17.6678221	15.73122735	21.80555613	18.35847401	11.05882949	16.27302103	5.476572673	5.08984985	5.045546934	9.23189385	2.792200976	3.422737477	21.42305877	17.08689239	24.96980923	19.40980698	23.44163365	22.11691827	12.99432063	7.619495482	4.599785228	7.326406291	3.198784354	3.409098351	16.32844096	15.74771278	22.51900738	26.97890424	21.59619376	17.43209944	8.734122681	20.59216081	10.36245429	7.26546569	12.04595229	8.063501072	15.74811407	17.19908695	16.41296552	18.28390575	17.82708082	15.86006848	11.9683489	13.43585855	3.714800877	8.654756058	4.897009662	13.83045077
olfm3	protein_coding	chrNC_030680.1:99134137-99161041:-	gi|512834087|ref|XP_002934209.2|	2517	0	PREDICTED: noelin-3 isoform X2 [Xenopus tropicalis]	gi|847124175|ref|XM_002934163.3|	2566	0	PREDICTED: Xenopus (Silurana) tropicalis olfactomedin 3 (olfm3), transcript variant X2, mRNA	Q96PB7	841	0	Noelin-3	.	.	.	.	pfam02191	OLF	Olfactomedin-like domain.	GO:0042462|eye photoreceptor cell development;	GO:0032281|AMPA glutamate receptor complex;GO:0030054|cell junction;GO:0005615|extracellular space;GO:0005794|Golgi apparatus;GO:0045202|synapse;	.	.	.	14.9828809	10.82308263	11.6871715	8.541674536	10.64531772	10.83277271	1.363489829	1.047691925	1.212976432	1.145801493	1.366126011	0.65427336	13.10019339	11.20350549	10.57376267	11.52372881	12.43002359	11.12243043	1.284657807	13.41578042	0.489833976	1.233908528	1.999385925	2.305261728	10.39024613	9.116616798	9.864367938	11.99189161	13.65161956	10.65382068	0.344298151	0.792801555	0.957390945	1.162120904	7.26389412	1.327745703	12.90024155	11.80448073	13.28047063	13.43462627	11.49520428	8.304690174	1.724382278	0.847288529	0.398350316	2.004423172	1.451425412	1.19632514
vip	protein_coding	chrNC_030681.1:43999375-44010570:-	gi|512842427|ref|XP_002936422.2|	1001	1.00E-129	PREDICTED: VIP peptides [Xenopus tropicalis]	gi|847130978|ref|XM_002936376.3|	1821	0	PREDICTED: Xenopus (Silurana) tropicalis vasoactive intestinal peptide (vip), mRNA	P48143	233	7.00E-71	VIP peptides	.	.	.	.	pfam00123	Hormone_2	Peptide hormone. This family contains glucagon, GIP, secretin and VIP.	GO:0048242|epinephrine secretion;GO:0010467|gene expression;GO:0048255|mRNA stabilization;GO:0030819|positive regulation of cAMP biosynthetic process;GO:0032812|positive regulation of epinephrine secretion;GO:0010628|positive regulation of gene expression;GO:0090277|positive regulation of peptide hormone secretion;GO:0070459|prolactin secretion;	GO:0005576|extracellular region;GO:0005615|extracellular space;	.	K05264	VIP; vasoactive intestinal peptide	14.4745161	11.97436686	12.29547003	20.10252779	14.53795457	14.56762222	14.70271049	14.4766815	10.51403025	25.54821087	12.23709942	9.768910999	11.24624962	8.240910111	11.39923758	17.1980386	14.68178997	11.91720946	11.61839805	52.27828794	19.95277415	23.20011455	13.30494415	26.48221746	16.5105837	16.08045086	2.452625471	14.42484988	15.63393438	16.58562677	14.24798336	9.894554705	8.332654084	21.94494424	13.46390848	25.88377968	14.30732801	13.25209526	11.12062052	11.41258347	16.28743621	1.68670227	8.974316176	13.73637815	13.65030783	8.724396434	12.33917493	7.04340874
nell2	protein_coding	chrNC_030679.1:54574219-54690283:+	gi|148235875|ref|NP_001090754.1|	4339	0	protein kinase C-binding protein NELL2 precursor [Xenopus tropicalis]	gi|148235874|ref|NM_001097285.1|	3892	0	Xenopus (Silurana) tropicalis neural EGFL like 2 (nell2), mRNA	A2VCU8	1675	0	Protein kinase C-binding protein NELL2	.	.	.	.	pfam12947	EGF_3	EGF domain. This family includes a variety of EGF-like domain homologues. This family includes the C-terminal domain of the malaria parasite MSP1 protein.	.	GO:0005576|extracellular region;	GO:0005509|calcium ion binding;	.	.	233.165955	306.9787354	286.9097783	255.2963013	216.7597626	260.996847	52.10046136	26.99226559	26.17602972	21.63869786	41.23834161	18.27919922	302.3753131	274.6510332	286.4070505	309.1115589	329.1957837	314.7883983	25.92686736	15.82123857	30.51063404	11.64748415	29.79493187	19.77702171	301.5966752	245.7377706	327.3695949	322.1009105	270.5247699	243.8345678	23.85707966	15.33051312	11.96093973	34.15278289	12.71011661	18.89480934	257.3268442	277.6425294	262.68462	293.8845585	292.58635	311.6502265	22.59746802	42.38291273	38.45962523	42.5748635	43.18213963	44.62881215
lum	protein_coding	chrNC_030679.1:46030704-46040500:-	gi|58332414|ref|NP_001011006.1|	1735	0	lumican precursor [Xenopus tropicalis]	gi|58332413|ref|NM_001011006.1|	2090	0	Xenopus (Silurana) tropicalis lumican (lum), mRNA	Q9DE67	476	2.00E-161	Lumican	alr0124_1	80.9	3.00E-15	COG4886	pfam13855	LRR_8	Leucine rich repeat.	GO:0030199|collagen fibril organization;GO:0007601|visual perception;	GO:0005578|proteinaceous extracellular matrix;	.	K08122	LUM; lumican	3.686164393	3.975830113	5.966342208	7.246535233	4.120982042	4.894803618	425.8447265	206.3564158	282.929315	257.0535965	281.9199692	215.9769452	3.782228177	4.742914124	2.890324284	6.144142537	6.067690901	4.241943266	244.0816983	112.1546522	200.1841958	103.5458559	193.0528177	229.532905	4.198075134	3.954120109	2.722454942	3.696287079	3.32077895	3.961714588	129.9357863	176.3207915	72.88628392	176.9724726	77.60883431	122.0831026	5.306797302	6.338527933	3.916605651	6.87665643	4.557915252	4.087184536	153.2262529	372.3515057	214.8274151	352.9491049	290.1077181	182.921922
gal.2	protein_coding	chrNC_030683.1:104560079-104569835:+	gi|512855145|ref|XP_004916350.1|	622	3.00E-76	PREDICTED: galanin peptides [Xenopus tropicalis]	gi|512855144|ref|XM_004916293.1|	1353	0	PREDICTED: Xenopus (Silurana) tropicalis galanin prepropeptide, gene 2 (gal.2), mRNA	E7EZ53	111	7.00E-28	Galanin peptides	.	.	.	.	pfam06540	GMAP	Galanin message associated peptide (GMAP). This family consists of several galanin message associated peptides. In rat preprogalanin, galanin is C-terminally flanked by a 60 amino acid long peptide: galanin message-associated peptide (GMAP). GMAP sequences in different species show high degree of homology, but the biological function of this family is unknown.	GO:0007218|neuropeptide signaling pathway;GO:0045944|positive regulation of transcription from RNA polymerase II promoter;	GO:0005615|extracellular space;GO:0030141|secretory granule;	GO:0004966|galanin receptor activity;GO:0031763|galanin receptor binding;GO:0005184|neuropeptide hormone activity;GO:0031764|type 1 galanin receptor binding;GO:0031765|type 2 galanin receptor binding;GO:0031766|type 3 galanin receptor binding;	K05244	GAL; galanin	129.8788897	47.91545339	84.37707037	124.8597058	85.99007566	68.78985481	0.09241767	0.0	0.084468324	0.04346793	0.087907928	0.081122207	37.72135053	7.474537323	34.44249699	131.6475064	53.12457771	42.06871828	0.0	0.130317254	0.042932412	0.0	0.0	0.0	70.37723438	37.50420879	8.129086957	72.8020192	69.15594291	81.61839789	0.138177307	0.268681404	0.0	0.085618299	0.137101995	0.0	46.63049742	68.04861818	78.6672615	71.2096111	21.84676084	6.720873572	0.175318571	0.043072066	0.0	0.0	0.0	0.0
sfrp1	protein_coding	chrNC_030679.1:107234062-107245908:+	gi|183986759|ref|NP_001116878.1|	1602	0	secreted frizzled-related protein 1 precursor [Xenopus tropicalis]	gi|183986758|ref|NM_001123406.1|	1554	0	Xenopus (Silurana) tropicalis secreted frizzled-related protein 1 (sfrp1), mRNA	Q8C4U3	401	2.00E-135	Secreted frizzled-related protein 1	.	.	.	.	pfam01392	Fz	Fz domain. Also known as the CRD (cysteine rich domain), the C6 box in MuSK receptor. This domain of unknown function has been independently identified by several groups. The domain contains 10 conserved cysteines.	GO:0030036|actin cytoskeleton organization;GO:0009952|anterior/posterior pattern specification;GO:0060346|bone trabecula formation;GO:0060070|canonical Wnt signaling pathway;GO:0071773|cellular response to BMP stimulus;GO:0071392|cellular response to estradiol stimulus;GO:0071391|cellular response to estrogen stimulus;GO:0044344|cellular response to fibroblast growth factor stimulus;GO:0071363|cellular response to growth factor stimulus;GO:0071504|cellular response to heparin;GO:0071456|cellular response to hypoxia;GO:0071347|cellular response to interleukin-1;GO:0071380|cellular response to prostaglandin E stimulus;GO:0009267|cellular response to starvation;GO:0071560|cellular response to transforming growth factor beta stimulus;GO:0071356|cellular response to tumor necrosis factor;GO:0071305|cellular response to vitamin D;GO:0071481|cellular response to X-ray;GO:0090246|convergent extension involved in somitogenesis;GO:0046546|development of primary male sexual characteristics;GO:0048546|digestive tract morphogenesis;GO:0071542|dopaminergic neuron differentiation;GO:0009950|dorsal/ventral axis specification;GO:0008585|female gonad development;GO:0002244|hematopoietic progenitor cell differentiation;GO:0060218|hematopoietic stem cell differentiation;GO:0030097|hemopoiesis;GO:0008584|male gonad development;GO:0060766|negative regulation of androgen receptor signaling pathway;GO:0043066|negative regulation of apoptotic process;GO:0045578|negative regulation of B cell differentiation;GO:0030514|negative regulation of BMP signaling pathway;GO:0046851|negative regulation of bone remodeling;GO:0090090|negative regulation of canonical Wnt signaling pathway;GO:2000080|negative regulation of canonical Wnt signaling pathway involved in controlling type B pancreatic cell proliferation;GO:0030308|negative regulation of cell growth;GO:0030336|negative regulation of cell migration;GO:0008285|negative regulation of cell proliferation;GO:0050680|negative regulation of epithelial cell proliferation;GO:0010719|negative regulation of epithelial to mesenchymal transition;GO:2000270|negative regulation of fibroblast apoptotic process;GO:0048147|negative regulation of fibroblast proliferation;GO:0010629|negative regulation of gene expression;GO:0046676|negative regulation of insulin secretion;GO:0043508|negative regulation of JUN kinase activity;GO:0030279|negative regulation of ossification;GO:0045668|negative regulation of osteoblast differentiation;GO:0033689|negative regulation of osteoblast proliferation;GO:0045671|negative regulation of osteoclast differentiation;GO:0050732|negative regulation of peptidyl-tyrosine phosphorylation;GO:2000041|negative regulation of planar cell polarity pathway involved in axis elongation;GO:0045892|negative regulation of transcription, DNA-templated;GO:0030178|negative regulation of Wnt signaling pathway;GO:2000054|negative regulation of Wnt signaling pathway involved in dorsal/ventral axis specification;GO:0014034|neural crest cell fate commitment;GO:0001843|neural tube closure;GO:0021915|neural tube development;GO:0001649|osteoblast differentiation;GO:0090179|planar cell polarity pathway involved in neural tube closure;GO:0043065|positive regulation of apoptotic process;GO:0090263|positive regulation of canonical Wnt signaling pathway;GO:0030307|positive regulation of cell growth;GO:0008284|positive regulation of cell proliferation;GO:0050679|positive regulation of epithelial cell proliferation;GO:2001238|positive regulation of extrinsic apoptotic signaling pathway;GO:1902043|positive regulation of extrinsic apoptotic signaling pathway via death domain receptors;GO:0045600|positive regulation of fat cell differentiation;GO:2000271|positive regulation of fibroblast apoptotic process;GO:2000052|positive regulation of non-canonical Wnt signaling pathway;GO:0045880|positive regulation of smoothened signaling pathway;GO:0045893|positive regulation of transcription, DNA-templated;GO:0030177|positive regulation of Wnt signaling pathway;GO:0060527|prostate epithelial cord arborization involved in prostate glandular acinus morphogenesis;GO:0060687|regulation of branching involved in prostate gland morphogenesis;GO:0010564|regulation of cell cycle process;GO:0090175|regulation of establishment of planar polarity;GO:1904956|regulation of midbrain dopaminergic neuron differentiation;GO:0010975|regulation of neuron projection development;GO:0042493|response to drug;GO:0014070|response to organic cyclic compound;GO:0035019|somatic stem cell population maintenance;GO:0001756|somitogenesis;GO:0044345|stromal-epithelial cell signaling involved in prostate gland development;GO:0034446|substrate adhesion-dependent cell spreading;GO:0001657|ureteric bud development;GO:0090244|Wnt signaling pathway involved in somitogenesis;GO:0060071|Wnt signaling pathway, planar cell polarity pathway;	GO:0009986|cell surface;GO:0005829|cytosol;GO:0070062|extracellular exosome;GO:0031012|extracellular matrix;GO:0005615|extracellular space;GO:0016021|integral component of membrane;GO:0005622|intracellular;GO:0005886|plasma membrane;GO:0005578|proteinaceous extracellular matrix;	GO:0004197|cysteine-type endopeptidase activity;GO:0008144|drug binding;GO:0005109|frizzled binding;GO:0004930|G-protein coupled receptor activity;GO:0008201|heparin binding;GO:0042802|identical protein binding;GO:0042813|Wnt-activated receptor activity;GO:0017147|Wnt-protein binding;	K02166	SFRP1; secreted frizzled-related protein 1	4.65440521	18.47210265	6.323212478	14.31205546	7.852691473	18.01963891	35.88695871	15.78815934	24.67363774	31.222645	35.89613327	14.1259132	7.496169586	16.56882036	6.288408239	10.94079435	4.254625186	8.64813554	31.9531122	22.95705302	19.17562087	17.29404057	26.69655822	16.6573051	4.104504424	5.481086002	2.21709247	17.99255639	17.17302196	13.15342365	26.22647962	27.5646546	19.14268488	37.60750744	20.17331457	36.74833281	11.88470209	6.317399506	11.30371708	12.22219669	6.464356941	6.458401017	28.69673933	33.37586194	32.54064685	38.14775875	31.7799313	36.33551156
hapln1	protein_coding	chrNC_030677.1:168858285-168934270:-	gi|512810596|ref|XP_002933976.2|	1762	0	PREDICTED: hyaluronan and proteoglycan link protein 1 [Xenopus tropicalis]	gi|847090129|ref|XM_002933930.3|	4989	0	PREDICTED: Xenopus (Silurana) tropicalis hyaluronan and proteoglycan link protein 1 (hapln1), transcript variant X1, mRNA	P55252	574	0	Hyaluronan and proteoglycan link protein 1	.	.	.	.	pfam00193	Xlink	Extracellular link domain.	GO:0007155|cell adhesion;GO:0007417|central nervous system development;GO:0098779|positive regulation of mitophagy in response to mitochondrial depolarization;GO:0001501|skeletal system development;	GO:0005578|proteinaceous extracellular matrix;	GO:0005201|extracellular matrix structural constituent;GO:0005540|hyaluronic acid binding;	K06848	HAPLN1, CRTL1; hyaluronan and proteoglycan link protein 1	5.617366303	1.848229102	2.214898059	2.366234442	5.338074947	5.324474552	4.259063962	1.524015185	3.595040245	2.179972001	2.156685657	0.835667628	2.720863333	2.29973961	3.862645356	2.588963287	2.741256431	1.973825126	2.630608221	0.176637191	1.897068961	1.059685355	1.678658204	1.925355357	4.081712717	3.99415476	1.407180386	2.904829114	2.548692791	3.580304207	1.460869955	3.022706172	0.636534218	1.624706299	0.953945297	0.597715237	5.343622414	4.904180402	3.363106849	4.253215547	3.272520775	1.430566495	1.069351951	2.37029263	0.763768794	1.622825739	1.600144898	1.19466116
