GeneName	Biotype	Position	NR:Seq-id	NR:Score	NR:Evalue	NR:Description	NT:Seq-id	NT:Score	NT:Evalue	NT:Description	Uniprot:UniProtKB-AC	Uniprot:Score	Uniprot:Evalue	Uniprot:Description	COG:gene	COG:Score	COG:Eval	COG:num	Pfam:pfam_ID	Pfam:pfam_Name	Pfam:pfam_Description	GO:biological_process	GO:cellular_component	GO:molecular_function	KEGG:KO	KEGG:Description	Lbra1	Lbra2	Lbra3	Lbra4	Lbra5	Lbra6	Lski1	Lski2	Lski3	Lski4	Lski5	Lski6	LMbra1	LMbra2	LMbra3	LMbra4	LMbra5	LMbra6	LMski1	LMski2	LMski3	LMski4	LMski5	LMski6	Mbra1	Mbra2	Mbra3	Mbra4	Mbra5	Mbra6	Mski1	Mski2	Mski3	Mski4	Mski5	Mski6	MLbra1	MLbra2	MLbra3	MLbra4	MLbra5	MLbra6	MLski1	MLski2	MLski3	MLski4	MLski5	MLski6
col5a3	protein_coding	chrNC_030679.1:126399455-126520015:+	gi|847169802|ref|XP_012808459.1|	5648	0	PREDICTED: collagen alpha-3(V) chain isoform X1 [Xenopus tropicalis]	gi|847169801|ref|XM_012953005.1|	6900	0	PREDICTED: Xenopus (Silurana) tropicalis collagen, type V, alpha 3 (col5a3), transcript variant X1, mRNA	Q61245	298	8.00E-80	Collagen alpha-1(XI) chain	.	.	.	.	pfam01410	COLFI	Fibrillar collagen C-terminal domain. Found at C-termini of fibrillar collagens: Ephydatia muelleri procollagen EMF1 alpha, vertebrate collagens alpha(1)III, alpha(1)II, alpha(2)V etc.	GO:0001502|cartilage condensation;GO:0051216|cartilage development;GO:0002063|chondrocyte development;GO:0030199|collagen fibril organization;GO:0050910|detection of mechanical stimulus involved in sensory perception of sound;GO:0048704|embryonic skeletal system morphogenesis;GO:0035987|endodermal cell differentiation;GO:0003007|heart morphogenesis;GO:0042472|inner ear morphogenesis;GO:0001503|ossification;GO:0006029|proteoglycan metabolic process;GO:0007605|sensory perception of sound;GO:0048705|skeletal system morphogenesis;GO:0035989|tendon development;GO:0055010|ventricular cardiac muscle tissue morphogenesis;GO:0007601|visual perception;	GO:0005581|collagen trimer;GO:0005592|collagen type XI trimer;GO:0005578|proteinaceous extracellular matrix;	GO:0005201|extracellular matrix structural constituent;GO:0046872|metal ion binding;	.	.	19.53191835	17.10116501	11.30640859	5.324948135	11.05567249	7.735124239	2.970383243	4.590646374	2.751365741	5.872117699	1.965652383	4.045317278	15.45843803	15.89920964	15.52824651	11.94608802	16.02508121	10.33337846	2.479838417	1.164930588	1.778196305	1.842925118	2.223957584	2.608016339	5.992069504	10.55851707	24.40785077	9.349505606	10.90514221	8.584286922	2.278955356	1.660237637	2.055122871	2.297556736	1.537147083	3.447664758	10.79624009	12.23853507	17.51499563	9.800389304	10.39896854	14.00531327	2.130559354	6.292461364	1.860866857	3.418958862	2.92645674	3.237590262
proca1	protein_coding	chrNC_030678.1:26808988-26821814:+	gi|512825264|ref|XP_002937670.2|	2835	0	PREDICTED: protein PROCA1 [Xenopus tropicalis]	gi|847106905|ref|XM_002937624.3|	2720	0	PREDICTED: Xenopus (Silurana) tropicalis protein interacting with cyclin A1 (proca1), mRNA	Q9NZ20	158	5.00E-39	Group 3 secretory phospholipase A2	.	.	.	.	pfam05826	Phospholip_A2_2	Phospholipase A2. This family consists of several phospholipase A2 like proteins mostly from insects.	GO:0001675|acrosome assembly;GO:0050482|arachidonic acid secretion;GO:0060271|cilium assembly;GO:0016042|lipid catabolic process;GO:0019372|lipoxygenase pathway;GO:0043303|mast cell degranulation;GO:0036151|phosphatidylcholine acyl-chain remodeling;GO:0036152|phosphatidylethanolamine acyl-chain remodeling;GO:0036148|phosphatidylglycerol acyl-chain remodeling;GO:0006644|phospholipid metabolic process;GO:0007288|sperm axoneme assembly;	GO:0005814|centriole;GO:0005576|extracellular region;GO:0005615|extracellular space;GO:0042629|mast cell granule;GO:0005886|plasma membrane;	GO:0047498|calcium-dependent phospholipase A2 activity;GO:0046872|metal ion binding;GO:0004623|phospholipase A2 activity;	K01047	PLA2G, SPLA2; secretory phospholipase A2 [EC:3.1.1.4]	81.28849875	185.5359155	60.95166148	64.42004482	58.53980278	169.499907	0.881747499	1.796084578	1.729046739	3.741216754	0.32316745	2.969461028	100.6910143	102.5394124	89.46011299	118.6025735	74.37101274	115.6536519	0.345002833	0.178275643	0.143675455	0.703916629	0.398387497	0.258434609	88.14932342	64.18706448	58.1070554	135.8612774	128.8227924	93.41429457	0.496976044	0.108427744	0.03553348	0.326354609	0.181229238	0.89090315	102.2472457	56.03819389	121.0601179	128.4658995	95.83748528	66.10647258	1.011768996	3.292327883	0.311354819	2.290043282	2.341209457	0.467820941
fbn1	protein_coding	chrNC_030679.1:93845661-93969772:-	gi|512827448|ref|XP_002936615.2|	14414	0	PREDICTED: fibrillin-1 [Xenopus tropicalis]	gi|847111608|ref|XM_002936569.3|	10642	0	PREDICTED: Xenopus (Silurana) tropicalis fibrillin 1 (fbn1), mRNA	P98133	97.1	3.00E-18	Fibrillin-1	.	.	.	.	pfam00683	TB	TB domain. This domain is also known as the 8 cysteine domain. This family includes the hybrid domains. This cysteine rich repeat is found in TGF binding protein and fibrillin.	GO:0034199|activation of protein kinase A activity;GO:0009653|anatomical structure morphogenesis;GO:0042593|glucose homeostasis;GO:0006006|glucose metabolic process;GO:0010737|protein kinase A signaling;GO:0090287|regulation of cellular response to growth factor stimulus;	GO:0005576|extracellular region;GO:0005615|extracellular space;GO:0005622|intracellular;GO:0001527|microfibril;	GO:0005509|calcium ion binding;GO:0005201|extracellular matrix structural constituent;GO:0008201|heparin binding;GO:0005179|hormone activity;	K06825	FBN1; fibrillin 1	4.569906893	4.230965702	3.860108701	2.777172013	3.434068518	3.448139145	30.01522444	44.97909937	24.96849115	33.33392482	17.89486191	25.23494138	3.676987617	3.946934516	3.922932151	3.764600772	3.31555669	3.622823962	22.53868141	10.59651496	19.12386574	14.83948367	23.27011346	18.35400064	2.923413909	3.167447773	3.555038689	3.474534577	4.368439357	3.122698044	20.63941854	12.10750323	15.4885303	18.59418937	9.896583726	26.69795986	3.379910666	3.901923224	3.661947361	4.452607878	2.61456244	2.246957471	23.93302966	47.8010887	20.56966403	40.22736474	32.22133043	27.0626583
lipg	protein_coding	chrNC_030677.1:191708348-191716434:+	gi|512809666|ref|XP_002934486.2|	2714	0	PREDICTED: endothelial lipase isoform X1 [Xenopus tropicalis]	gi|847089267|ref|XM_002934440.3|	1923	0	PREDICTED: Xenopus (Silurana) tropicalis lipase, endothelial (lipg), transcript variant X1, mRNA	Q9Y5X9	666	0	Endothelial lipase	.	.	.	.	pfam00151	Lipase	Lipase.	GO:0008283|cell proliferation;GO:0042632|cholesterol homeostasis;GO:0034375|high-density lipoprotein particle remodeling;GO:0044241|lipid digestion;GO:0006629|lipid metabolic process;GO:0009395|phospholipid catabolic process;GO:0055091|phospholipid homeostasis;GO:0032376|positive regulation of cholesterol transport;GO:0010983|positive regulation of high-density lipoprotein particle clearance;GO:0050746|regulation of lipoprotein metabolic process;GO:0007584|response to nutrient;GO:0043691|reverse cholesterol transport;	GO:0009986|cell surface;GO:0005769|early endosome;GO:0005576|extracellular region;GO:0005615|extracellular space;GO:0005794|Golgi apparatus;	GO:0008201|heparin binding;GO:0004465|lipoprotein lipase activity;GO:0008970|phosphatidylcholine 1-acylhydrolase activity;GO:0004620|phospholipase activity;	K01046	E3.1.1.3; triacylglycerol lipase [EC:3.1.1.3]	5.405187673	13.56213396	4.393881487	4.434653065	4.994134911	11.52911117	9.100690692	13.83200144	5.332912872	16.87440886	4.00636337	7.753713062	4.529635814	10.85152899	5.853361128	8.776656439	5.70515591	5.172293363	5.922083676	11.73987994	4.721078447	4.814002094	5.740152189	7.216076309	2.63149783	4.631504225	4.980681608	8.757013512	12.25382013	9.56759256	5.270109207	3.598313831	6.119766589	6.879625746	5.561836447	6.589049652	5.511904979	3.794412911	7.482097008	7.5384975	5.15136213	7.000076878	7.162800222	9.674566683	3.919303505	9.986156391	4.56808771	3.93278583
LOC100495918	protein_coding	chrNC_030683.1:54214330-54218021:-	gi|301616248|ref|XP_002937572.1|	593	3.00E-74	PREDICTED: C-type natriuretic peptide 1-like isoform X2 [Xenopus tropicalis]	gi|301616247|ref|XM_002937526.1|	776	0	PREDICTED: Xenopus (Silurana) tropicalis C-type natriuretic peptide 1-like (LOC100495918), transcript variant X2, mRNA	P20968	145	8.00E-42	C-type natriuretic peptide 1	.	.	.	.	pfam00212	ANP	Atrial natriuretic peptide.	GO:0006182|cGMP biosynthetic process;GO:0003418|growth plate cartilage chondrocyte differentiation;GO:0003419|growth plate cartilage chondrocyte proliferation;GO:0007168|receptor guanylyl cyclase signaling pathway;GO:0050880|regulation of blood vessel size;	GO:0005576|extracellular region;	.	.	.	106.4347311	61.18196621	86.26479291	198.0776226	100.2817142	79.2125565	0.0	1.19511688	0.973002591	0.497882043	0.0	0.242345872	72.8189877	60.5241453	73.41647159	111.7797478	60.65381418	99.05275996	1.443965789	27.61154715	0.101064785	0.412626632	0.802492247	0.169669869	80.4345345	113.8109818	12.72201856	107.2309564	95.39718315	116.9595472	5.791457389	0.622877334	5.423938418	6.089532645	3.812841513	4.468016215	87.79383484	81.46270381	85.93511718	48.35894606	100.2102379	13.02024906	0.0	0.081463923	0.085172306	2.050200417	0.0	0.0
enpp2	protein_coding	chrNC_030682.1:122888601-122942850:-	gi|847135208|ref|XP_012820111.1|	4946	0	PREDICTED: ectonucleotide pyrophosphatase/phosphodiesterase family member 2 isoform X1 [Xenopus tropicalis]	gi|847135211|ref|XM_012964658.1|	3508	0	PREDICTED: Xenopus (Silurana) tropicalis ectonucleotide pyrophosphatase/phosphodiesterase 2 (enpp2), transcript variant X2, mRNA	Q64610	1380	0	Ectonucleotide pyrophosphatase/phosphodiesterase family member 2	SPBC725.05c	214	3.00E-59	COG1524	pfam01663	Phosphodiest	Type I phosphodiesterase / nucleotide pyrophosphatase. This family consists of phosphodiesterases, including human plasma-cell membrane glycoprotein PC-1 / alkaline phosphodiesterase i / nucleotide pyrophosphatase (nppase). These enzymes catalyse the cleavage of phosphodiester and phosphosulfate bonds in NAD, deoxynucleotides and nucleotide sugars. Also in this family is ATX an autotaxin, tumor cell motility-stimulating protein which exhibits type I phosphodiesterases activity. The alignment encompasses the active site. Also present with in this family is 60-kDa Ca2+-ATPase form F. odoratum.	GO:0006935|chemotaxis;GO:0006955|immune response;GO:0034638|phosphatidylcholine catabolic process;GO:0009395|phospholipid catabolic process;GO:0010634|positive regulation of epithelial cell migration;GO:2000394|positive regulation of lamellipodium morphogenesis;GO:0050731|positive regulation of peptidyl-tyrosine phosphorylation;GO:0045765|regulation of angiogenesis;GO:0030334|regulation of cell migration;	GO:0005615|extracellular space;GO:0005887|integral component of plasma membrane;	GO:0047391|alkylglycerophosphoethanolamine phosphodiesterase activity;GO:0005509|calcium ion binding;GO:0004622|lysophospholipase activity;GO:0003676|nucleic acid binding;GO:0004551|nucleotide diphosphatase activity;GO:0004528|phosphodiesterase I activity;GO:0030247|polysaccharide binding;GO:0005044|scavenger receptor activity;GO:0008270|zinc ion binding;	K01122	ENPP2; ectonucleotide pyrophosphatase/phosphodiesterase family member 2 [EC:3.1.4.39]	49.78211546	60.45706982	26.6717061	31.76011032	60.37420354	63.25102018	12.84405062	19.88783474	12.92709631	15.0186657	12.73787907	8.089159453	42.9005209	88.49823326	61.61108833	56.73800875	37.95166677	36.22982734	14.54554251	3.606725007	14.54123261	7.374055729	16.39697935	14.12316942	48.04483704	49.12735011	19.94966314	74.71686945	59.3508448	62.23447993	9.368739759	4.741104252	4.733751568	11.92345929	3.700117116	10.89678108	68.04408215	40.84874741	54.33475035	61.73500384	53.40647224	20.10125162	11.01126492	13.68019327	17.25181774	22.75779063	15.88746662	10.37795944
crhbp	protein_coding	chrNC_030677.1:164885851-164898367:+	gi|301623231|ref|XP_002940913.1|	1639	0	PREDICTED: corticotropin-releasing factor-binding protein [Xenopus tropicalis]	gi|847089755|ref|XM_002940867.3|	1244	0	PREDICTED: Xenopus (Silurana) tropicalis corticotropin releasing hormone binding protein (crhbp), mRNA	Q91653	611	0	Corticotropin-releasing factor-binding protein	.	.	.	.	pfam05428	CRF-BP	Corticotropin-releasing factor binding protein (CRF-BP). This family consists of several eukaryotic corticotropin-releasing factor binding proteins (CRF-BP or CRH-BP). Corticotropin-releasing hormone (CRH) plays multiple roles in vertebrate species. In mammals, it is the major hypothalamic releasing factor for pituitary adrenocorticotropin secretion, and is a neurotransmitter or neuromodulator at other sites in the central nervous system. In non-mammalian vertebrates, CRH not only acts as a neurotransmitter and hypophysiotropin, it also acts as a potent thyrotropin-releasing factor, allowing CRH to regulate both the adrenal and thyroid axes, especially in development. CRH-BP is thought to play an inhibitory role in which it binds CRH and other CRH-like ligands and prevents the activation of CRH receptors. There is however evidence that CRH-BP may also exhibit diverse extra and intracellular roles in a cell specific fashion and at specific times in development.	.	GO:0005576|extracellular region;	GO:0051424|corticotropin-releasing hormone binding;	.	.	21.82178821	11.58992329	12.26025556	13.03846829	19.78641484	16.04843835	6.024740086	3.800264488	7.834114897	1.573030001	1.513660763	2.074740387	10.44762175	12.27175303	21.26859587	14.22618346	15.3209528	15.19073783	19.11419007	9.906284133	21.32156366	5.601577244	31.57017568	3.683266792	23.02875109	20.04098173	8.980454206	14.97697737	15.91447898	18.28556073	2.643659302	5.441324004	0.748947189	14.48136824	5.258439238	3.775424089	16.94555871	16.98827881	17.99509003	13.98313602	14.1807522	8.174267631	7.693625444	5.778610315	13.74999149	6.320778119	14.40320775	1.571157504
