GeneName	Biotype	Position	NR:Seq-id	NR:Score	NR:Evalue	NR:Description	NT:Seq-id	NT:Score	NT:Evalue	NT:Description	Uniprot:UniProtKB-AC	Uniprot:Score	Uniprot:Evalue	Uniprot:Description	COG:gene	COG:Score	COG:Eval	COG:num	Pfam:pfam_ID	Pfam:pfam_Name	Pfam:pfam_Description	GO:biological_process	GO:cellular_component	GO:molecular_function	KEGG:KO	KEGG:Description	Lliv1	Lliv2	Lliv3	Lliv4	Lliv5	Lliv6	Lski1	Lski2	Lski3	Lski4	Lski5	Lski6	LMliv1	LMliv2	LMliv3	LMliv4	LMliv5	LMliv6	LMski1	LMski2	LMski3	LMski4	LMski5	LMski6	Mliv1	Mliv2	Mliv3	Mliv4	Mliv5	Mliv6	Mski1	Mski2	Mski3	Mski4	Mski5	Mski6	MLliv1	MLliv2	MLliv3	MLliv4	MLliv5	MLliv6	MLski1	MLski2	MLski3	MLski4	MLski5	MLski6
lipc	protein_coding	chrNC_030679.1:89435756-89502206:-	gi|166795961|ref|NP_001107731.1|	2579	0	hepatic triacylglycerol lipase precursor [Xenopus tropicalis]	gi|847162346|ref|XM_012970028.1|	1704	0	PREDICTED: Xenopus (Silurana) tropicalis lipase, hepatic (lipc), transcript variant X1, mRNA	O46559	601	0	Hepatic triacylglycerol lipase	.	.	.	.	pfam00151	Lipase	Lipase.	GO:0016042|lipid catabolic process;	GO:0034364|high-density lipoprotein particle;	GO:0008201|heparin binding;GO:0004806|triglyceride lipase activity;	K01046	E3.1.1.3; triacylglycerol lipase [EC:3.1.1.3]	68.02299065	370.7701324	72.60821506	344.7096398	41.44763213	424.4194662	4.443495712	5.581135117	4.352085836	4.340659781	0.201058816	3.086571572	86.56878898	402.1348328	42.07202107	229.4322234	38.78045698	73.48120689	1.893157547	2.831339451	3.953493261	1.42644011	3.406907295	0.926122991	164.2716643	241.0841135	219.7162393	35.11885621	299.1276311	133.5223515	1.855163604	0.404750303	0.397929151	2.231321523	3.874564447	5.653614293	143.0056437	351.3212697	42.2420576	462.5105059	52.41277643	188.454113	6.951938813	16.34130004	3.448030546	13.01705013	4.828735866	2.256796234
cxcl12	protein_coding	chrNC_030683.1:37782394-37841002:-	gi|62751610|ref|NP_001015764.1|	482	3.00E-53	stromal cell-derived factor 1 precursor [Xenopus tropicalis]	gi|62751609|ref|NM_001015764.1|	2962	0	Xenopus (Silurana) tropicalis chemokine (C-X-C motif) ligand 12 (cxcl12), mRNA	Q5EBF6	190	8.00E-55	Stromal cell-derived factor 1	.	.	.	.	pfam00048	IL8	Small cytokines (intecrine/chemokine), interleukin-8 like. Includes a number of secreted growth factors and interferons involved in mitogenic, chemotactic, and inflammatory activity. Structure contains two highly conserved disulfide bonds.	GO:0007411|axon guidance;GO:0060326|cell chemotaxis;GO:0070098|chemokine-mediated signaling pathway;GO:0007186|G-protein coupled receptor signaling pathway;GO:0006955|immune response;GO:0050930|induction of positive chemotaxis;GO:0006954|inflammatory response;GO:0007509|mesoderm migration involved in gastrulation;GO:0030335|positive regulation of cell migration;	GO:0009897|external side of plasma membrane;GO:0005615|extracellular space;	GO:0042056|chemoattractant activity;GO:0008009|chemokine activity;GO:0045236|CXCR chemokine receptor binding;	K10031	CXCL12; C-X-C motif chemokine 12	333.582523	147.6860771	445.3349618	145.0830062	194.3051448	118.6503067	16.40455987	20.74061536	24.23445159	17.10364697	15.29591741	13.05097894	387.1001413	156.4145678	401.2753486	123.780264	463.2664142	211.4891147	35.50171836	17.38432964	36.76396156	23.4181271	40.26557695	25.20093236	153.9566554	350.5976952	191.5378281	461.9585064	202.5456583	289.2316841	16.53659695	16.06847828	16.89189201	28.87086461	20.33588117	26.94743807	318.9523895	275.5195678	442.9333436	203.7886167	474.3245342	417.34103	23.10313941	19.25349759	23.61440782	15.82674862	27.55421219	16.99168582
gpi	protein_coding	chrNC_030680.1:19407485-19430385:-	gi|58332406|ref|NP_001011010.1|	2989	0	glucose-6-phosphate isomerase [Xenopus tropicalis]	gi|58332405|ref|NM_001011010.1|	2119	0	Xenopus (Silurana) tropicalis glucose-6-phosphate isomerase (gpi), mRNA	P06744	965	0	Glucose-6-phosphate isomerase	HI1576	722	0	COG0166	pfam00342	PGI	Phosphoglucose isomerase. Phosphoglucose isomerase catalyses the interconversion of glucose-6-phosphate and fructose-6-phosphate.	GO:0046185|aldehyde catabolic process;GO:0001525|angiogenesis;GO:0061621|canonical glycolysis;GO:0005975|carbohydrate metabolic process;GO:0034101|erythrocyte homeostasis;GO:0006094|gluconeogenesis;GO:0051156|glucose 6-phosphate metabolic process;GO:0042593|glucose homeostasis;GO:0007599|hemostasis;GO:0006959|humoral immune response;GO:0001701|in utero embryonic development;GO:0007611|learning or memory;GO:0001707|mesoderm formation;GO:0019242|methylglyoxal biosynthetic process;GO:0043154|negative regulation of cysteine-type endopeptidase activity involved in apoptotic process;GO:0043524|negative regulation of neuron apoptotic process;GO:0046686|response to cadmium ion;GO:0032355|response to estradiol;GO:0035902|response to immobilization stress;GO:0043278|response to morphine;GO:0035994|response to muscle stretch;GO:0032570|response to progesterone;GO:0033574|response to testosterone;	GO:0060170|ciliary membrane;GO:0005737|cytoplasm;GO:0005829|cytosol;GO:0070062|extracellular exosome;GO:0005615|extracellular space;GO:0016020|membrane;GO:0043209|myelin sheath;GO:0043005|neuron projection;GO:0005654|nucleoplasm;GO:0005886|plasma membrane;	GO:0004347|glucose-6-phosphate isomerase activity;GO:0016866|intramolecular transferase activity;GO:0048029|monosaccharide binding;GO:0031625|ubiquitin protein ligase binding;	K01810	GPI, pgi; glucose-6-phosphate isomerase [EC:5.3.1.9]	111.4673955	202.0963752	183.4665885	329.2881209	81.43683869	131.3077871	290.1915595	406.1489399	345.8871797	361.6342511	75.79021685	303.7422851	285.6424939	130.3616592	134.002726	242.7124339	208.9921843	69.69459292	192.9064212	211.4463216	189.8741354	224.1688806	277.2909049	142.2439468	136.102025	358.017169	463.5722409	181.0012525	144.6177583	399.7809733	253.1927287	248.7177295	302.5233554	252.1019457	255.5668189	374.7718861	250.6993776	206.9134778	100.8148942	161.9119034	106.7943401	157.9677177	429.2373877	665.7583978	211.170643	304.4721039	394.3741812	270.9682258
postn	protein_coding	chrNC_030678.1:148502816-148562230:+	gi|163915007|ref|NP_001106376.1|	4014	0	periostin precursor [Xenopus tropicalis]	gi|163915006|ref|NM_001112905.1|	3244	0	Xenopus (Silurana) tropicalis periostin, osteoblast specific factor (postn), mRNA	Q15063	1044	0	Periostin	MA1996	74.7	1.00E-13	COG2335	pfam02469	Fasciclin	Fasciclin domain. This extracellular domain is found repeated four times in grasshopper fasciclin I as well as in proteins from mammals, sea urchins, plants, yeast and bacteria.	GO:1990523|bone regeneration;GO:0007155|cell adhesion;GO:0044344|cellular response to fibroblast growth factor stimulus;GO:0071560|cellular response to transforming growth factor beta stimulus;GO:0071356|cellular response to tumor necrosis factor;GO:0071307|cellular response to vitamin K;GO:0030198|extracellular matrix organization;GO:0001953|negative regulation of cell-matrix adhesion;GO:1900025|negative regulation of substrate adhesion-dependent cell spreading;GO:1990138|neuron projection extension;GO:1904209|positive regulation of chemokine (C-C motif) ligand 2 secretion;GO:0014911|positive regulation of smooth muscle cell migration;GO:0008593|regulation of Notch signaling pathway;GO:0003073|regulation of systemic arterial blood pressure;GO:0032355|response to estradiol;GO:0001666|response to hypoxia;GO:0009612|response to mechanical stimulus;GO:0014850|response to muscle activity;GO:0001501|skeletal system development;	GO:0031012|extracellular matrix;GO:0005615|extracellular space;GO:0031594|neuromuscular junction;GO:0005578|proteinaceous extracellular matrix;GO:0005802|trans-Golgi network;	GO:0050839|cell adhesion molecule binding;GO:0008201|heparin binding;GO:0046872|metal ion binding;	.	.	12.18453874	6.9843457	16.26956566	7.400711624	10.47869511	3.479562084	423.6305587	593.3470481	234.5544617	1001.891492	449.6474717	653.7064898	20.38409704	14.79934175	14.92401062	10.64986463	16.47345903	7.744876505	257.6298993	151.157926	188.9490482	217.255109	249.3801404	403.7717164	14.93676077	23.24353772	11.28013887	17.11045462	16.10349213	20.11745738	383.7018613	189.7624466	294.1413035	263.1260766	165.3364361	531.0763924	18.82519938	12.49040631	20.35488162	5.846004822	18.72270131	10.58429547	243.9425931	563.6696211	389.256525	580.0964252	376.2316663	320.6667367
tnxb	protein_coding	chrNC_030684.1:54121735-54164968:+	gi|512860516|ref|XP_002941313.2|	14254	0	PREDICTED: tenascin-X [Xenopus tropicalis]	gi|847160309|ref|XM_002941267.3|	9544	0	PREDICTED: Xenopus (Silurana) tropicalis tenascin XB (tnxb), mRNA	P22105	304	5.00E-81	Tenascin-X	.	.	.	.	pfam00147	Fibrinogen_C	Fibrinogen beta and gamma chains, C-terminal globular domain.	GO:0030036|actin cytoskeleton organization;GO:0007155|cell adhesion;GO:0030199|collagen fibril organization;GO:0032963|collagen metabolic process;GO:0048251|elastic fiber assembly;	GO:0070062|extracellular exosome;GO:0005615|extracellular space;GO:0005622|intracellular;GO:0005578|proteinaceous extracellular matrix;	GO:0008201|heparin binding;GO:0005178|integrin binding;	K06252	TN; tenascin	5.164801051	2.672492438	6.825441331	1.900038158	6.609590692	1.670509282	9.995586158	14.49848174	8.230846451	16.60399416	9.290054434	10.01229244	8.367185669	4.407024232	5.708074219	2.297756747	11.87853126	3.521305874	7.310603896	9.01527034	8.074259181	6.807734411	21.91439238	3.702527784	3.437554935	5.552564868	2.37660868	12.06566916	2.824633448	4.245295152	5.641679202	7.687534239	4.024285674	7.994300926	7.160280431	10.85433385	6.954735884	3.655628001	7.808555127	2.010712174	10.27457345	6.558279503	10.38324044	14.07595569	7.531415534	8.650723462	12.46986711	9.425634272
nell2	protein_coding	chrNC_030679.1:54574219-54690283:+	gi|148235875|ref|NP_001090754.1|	4339	0	protein kinase C-binding protein NELL2 precursor [Xenopus tropicalis]	gi|148235874|ref|NM_001097285.1|	3892	0	Xenopus (Silurana) tropicalis neural EGFL like 2 (nell2), mRNA	A2VCU8	1675	0	Protein kinase C-binding protein NELL2	.	.	.	.	pfam12947	EGF_3	EGF domain. This family includes a variety of EGF-like domain homologues. This family includes the C-terminal domain of the malaria parasite MSP1 protein.	.	GO:0005576|extracellular region;	GO:0005509|calcium ion binding;	.	.	11.74178689	3.504201445	12.26704395	5.30837821	10.96654456	4.298306264	2.634199243	3.731500961	2.971261615	1.95129528	0.779559865	2.12121996	8.683549443	7.266901659	9.383728072	3.093848227	9.854309155	4.524749191	0.865521502	1.047745927	2.000266062	0.840924741	2.917973492	0.847835195	3.779841388	7.237149739	5.893523081	12.7493974	4.323190188	5.856521207	0.351656568	0.575420013	0.840012359	1.905969042	1.367149104	1.973968743	7.814186689	7.221792437	10.27487964	4.509814384	13.74356903	12.27851839	2.713657638	3.144836574	1.285155455	1.355928003	4.35554109	3.871622681
apoe	protein_coding	chrNC_030683.1:101372175-101377797:+	gi|49522289|gb|AAH75258.1|	1238	1.00E-164	apoe protein, partial [Xenopus tropicalis]	gi|847105036|ref|XM_002941039.3|	1749	0	PREDICTED: Xenopus (Silurana) tropicalis apolipoprotein E (apoe), transcript variant X4, mRNA	O42364	132	3.00E-33	Apolipoprotein Eb	.	.	.	.	pfam01442	Apolipoprotein	Apolipoprotein A1/A4/E domain. These proteins contain several 22 residue repeats which form a pair of alpha helices. This family includes: Apolipoprotein A-I. Apolipoprotein A-IV, and Apolipoprotein E.	GO:0006695|cholesterol biosynthetic process;GO:0006707|cholesterol catabolic process;GO:0033344|cholesterol efflux;GO:0042632|cholesterol homeostasis;GO:0034380|high-density lipoprotein particle assembly;GO:0042159|lipoprotein catabolic process;GO:0043524|negative regulation of neuron apoptotic process;GO:0031102|neuron projection regeneration;GO:0033700|phospholipid efflux;GO:0010873|positive regulation of cholesterol esterification;GO:0046889|positive regulation of lipid biosynthetic process;GO:0051000|positive regulation of nitric-oxide synthase activity;GO:0030516|regulation of axon extension;GO:1900221|regulation of amyloid-beta clearance;GO:0032374|regulation of cholesterol transport;GO:0043691|reverse cholesterol transport;GO:0019433|triglyceride catabolic process;GO:0034372|very-low-density lipoprotein particle remodeling;	GO:0072562|blood microparticle;GO:0042627|chylomicron;GO:0034364|high-density lipoprotein particle;GO:0034363|intermediate-density lipoprotein particle;	GO:0001540|amyloid-beta binding;GO:0015485|cholesterol binding;GO:0017127|cholesterol transporter activity;GO:0050750|low-density lipoprotein particle receptor binding;GO:0060228|phosphatidylcholine-sterol O-acyltransferase activator activity;GO:0005543|phospholipid binding;GO:0070326|very-low-density lipoprotein particle receptor binding;	K04524	APOE; apolipoprotein E	70.98252282	3.029478968	25.74059487	9.190922897	56.80650823	2.431168701	41.42984901	112.4746454	49.04123842	21.92018799	8.855392459	26.11949951	292.3821532	28.56098168	179.8572745	6.905785257	223.0290021	5.409628908	34.57190525	23.71149913	40.79362255	38.82142385	49.21874742	31.37413977	5.238617877	205.569687	13.20448792	194.387364	70.60455853	84.0364962	24.13329385	13.38885783	14.45735557	26.13111179	9.360576285	53.70044	77.07327703	4.544566532	86.41694773	4.411912251	77.83412487	49.31578744	70.37860054	106.4273797	35.96275349	109.4720667	57.24216023	11.27138195
mmp15	protein_coding	chrNC_030680.1:27645917-27683484:+	gi|62860164|ref|NP_001015921.1|	3159	0	matrix metalloproteinase-15 [Xenopus tropicalis]	gi|77682534|ref|NM_001015921.2|	3469	0	Xenopus tropicalis matrix metallopeptidase 15 (mmp15), mRNA	P51511	786	0	Matrix metalloproteinase-15	.	.	.	.	pfam00413	Peptidase_M10	Matrixin. The members of this family are enzymes that cleave peptides. These proteases require zinc for catalysis.	GO:0006464|cellular protein modification process;GO:0030574|collagen catabolic process;GO:0035987|endodermal cell differentiation;GO:0022617|extracellular matrix disassembly;GO:0006508|proteolysis;GO:0032355|response to estradiol;	GO:0031012|extracellular matrix;GO:0005887|integral component of plasma membrane;GO:0005886|plasma membrane;	GO:0005509|calcium ion binding;GO:0008047|enzyme activator activity;GO:0070006|metalloaminopeptidase activity;GO:0004222|metalloendopeptidase activity;GO:0004252|serine-type endopeptidase activity;GO:0008270|zinc ion binding;	K07995	MMP15; matrix metalloproteinase-15 (membrane-inserted) [EC:3.4.24.-]	4.176572094	1.350761624	3.854413005	2.068093497	2.285215972	1.64132173	2.643030967	2.362264157	2.89208086	4.88356348	1.458343535	3.277505713	3.456577315	2.75561913	4.404626383	1.637011414	3.997730589	1.465169956	2.08285178	1.81456493	1.599616606	1.545340673	2.663549867	2.174854802	1.519665709	3.628106754	1.987205256	3.725105493	2.475882257	2.629375567	1.691103402	1.487727699	1.521161626	2.111675529	2.007389149	1.666086619	2.823259149	1.994418627	4.804994539	1.667374637	3.643917818	2.54823324	1.920005804	4.503754394	2.297425683	2.608935492	2.29255714	1.817051148
clul1	protein_coding	chrNC_030682.1:93054729-93062799:-	gi|512847017|ref|XP_002934179.2|	1662	0	PREDICTED: clusterin-like protein 1 [Xenopus tropicalis]	gi|847138163|ref|XM_002934133.3|	1969	0	PREDICTED: Xenopus (Silurana) tropicalis clusterin-like 1 (retinal) (clul1), mRNA	Q95KN1	170	1.00E-44	Clusterin-like protein 1	.	.	.	.	pfam01093	Clusterin	Clusterin.	GO:0008219|cell death;	GO:0005576|extracellular region;	.	.	.	3.468993127	4.683833615	2.609429427	7.384355117	1.225167383	1.001737789	0.352824915	0.673367504	0.249191423	0.573796731	1.222596858	0.403429893	10.1897283	5.920006619	3.314562766	5.888854793	4.477953028	1.129551361	0.163150474	0.398536725	0.116474663	0.25362239	0.239776561	0.325900541	3.749631514	8.519478359	4.928699317	6.538229485	2.118791231	6.745572683	0.0	0.068366734	0.100821851	0.357399963	0.186987467	0.124830984	7.232099014	3.909886611	5.696369781	4.231060652	2.010659574	4.944263976	0.291942641	0.219065361	0.556234186	0.262533915	0.254883149	0.442461341
c1qtnf1	protein_coding	chrNC_030685.1:11842355-11853886:-	gi|163915089|ref|NP_001106527.1|	1379	0	complement C1q tumor necrosis factor-related protein 8 precursor [Xenopus tropicalis]	gi|847162294|ref|XM_012970010.1|	1150	0	PREDICTED: Xenopus (Silurana) tropicalis C1q and tumor necrosis factor related protein 1 (c1qtnf1), transcript variant X1, mRNA	Q5XIG2	295	5.00E-96	Complement C1q tumor necrosis factor-related protein 1	.	.	.	.	pfam00386	C1q	C1q domain. C1q is a subunit of the C1 enzyme complex that activates the serum complement system.	.	GO:0005581|collagen trimer;GO:0005576|extracellular region;	.	.	.	8.371254118	1.844899733	6.562766578	4.206739554	9.530432491	3.053378764	10.98638215	24.6234261	7.495786335	17.63801255	18.79078215	11.88323665	5.364232659	4.226177243	5.705659522	2.601460248	5.445430505	2.917766943	6.992487426	3.554041213	5.523937511	5.958472095	4.572732632	8.186054806	2.561342493	4.706623458	1.91136685	4.019589779	4.486436321	7.240899759	8.916787401	4.623374717	6.080288217	5.878311174	4.488783185	11.12786812	4.792623402	4.596995717	9.696339704	2.939502618	9.834613425	7.370573838	8.147879361	15.88645671	9.483010438	14.06496912	10.52113313	8.7882589
tgfbr3	protein_coding	chrNC_030680.1:94552854-94677662:+	gi|512835964|ref|XP_004913781.1|	4224	0	PREDICTED: transforming growth factor beta receptor type 3 isoform X1 [Xenopus tropicalis]	gi|847125798|ref|XM_004913724.2|	7692	0	PREDICTED: Xenopus (Silurana) tropicalis transforming growth factor, beta receptor III (tgfbr3), transcript variant X1, mRNA	P35054	487	5.00E-147	Transforming growth factor beta receptor type 3	.	.	.	.	pfam00100	Zona_pellucida	Zona pellucida-like domain.	GO:0030509|BMP signaling pathway;GO:0016049|cell growth;GO:0001837|epithelial to mesenchymal transition;GO:0006955|immune response;GO:0035556|intracellular signal transduction;GO:0051271|negative regulation of cellular component movement;GO:0032354|response to follicle-stimulating hormone;GO:0007165|signal transduction;GO:0007179|transforming growth factor beta receptor signaling pathway;	GO:0009897|external side of plasma membrane;GO:0031012|extracellular matrix;GO:0016021|integral component of membrane;GO:0005622|intracellular;GO:0005578|proteinaceous extracellular matrix;	GO:0015026|coreceptor activity;GO:0005539|glycosaminoglycan binding;GO:0008201|heparin binding;GO:0050431|transforming growth factor beta binding;GO:0070123|transforming growth factor beta receptor activity, type III;GO:0005160|transforming growth factor beta receptor binding;GO:0005024|transforming growth factor beta-activated receptor activity;	K05843	TGFBR3; transforming growth factor, beta receptor III	49.33157252	14.77127819	50.37673727	5.709394154	24.81539071	4.77444269	8.713613735	12.82402269	7.497612382	8.492837835	3.620858035	6.268679882	39.7270571	5.715072326	44.9064666	7.105436409	44.15079167	7.308122567	6.982356261	9.576022384	6.55329552	11.06643206	10.17790743	7.209773995	9.585408008	32.08010442	5.521950364	70.42912619	8.479183153	18.07654464	7.135715962	8.765730835	7.745294955	7.049924121	7.649228122	7.807877163	69.81019456	25.32773691	53.13216994	16.95062673	37.41383028	54.14911523	11.96295218	9.251884919	13.14521359	5.883323373	16.88104646	9.705120468
fbn2	protein_coding	chrNC_030677.1:159018045-159159808:+	gi|512810739|ref|XP_002931771.2|	14311	0	PREDICTED: fibrillin-2 [Xenopus tropicalis]	gi|847090290|ref|XM_002931725.3|	11646	0	PREDICTED: Xenopus (Silurana) tropicalis fibrillin 2 (fbn2), mRNA	Q61555	91.7	2.00E-16	Fibrillin-2	.	.	.	.	pfam00683	TB	TB domain. This domain is also known as the 8 cysteine domain. This family includes the hybrid domains. This cysteine rich repeat is found in TGF binding protein and fibrillin.	GO:0060346|bone trabecula formation;GO:0043010|camera-type eye development;GO:0048048|embryonic eye morphogenesis;GO:0030326|embryonic limb morphogenesis;GO:0035108|limb morphogenesis;GO:0030501|positive regulation of bone mineralization;GO:0045669|positive regulation of osteoblast differentiation;GO:0035583|sequestering of TGFbeta in extracellular matrix;	GO:0031012|extracellular matrix;GO:0005576|extracellular region;GO:0001527|microfibril;	GO:0005509|calcium ion binding;GO:0005201|extracellular matrix structural constituent;	.	.	2.288698867	1.605128103	2.602483496	1.201693376	1.963145303	1.02717817	1.758037875	1.805023972	0.945487376	4.075000214	1.113312698	2.766702267	2.963164313	2.229365125	2.765323265	1.584122353	2.613899119	1.521267463	1.007425455	0.935862933	0.855241002	1.044782255	0.647604368	1.158813447	1.79627106	3.295042634	1.69311332	3.139274955	1.223337149	1.737302921	1.940361586	1.162105334	1.334883848	1.093296938	0.85947442	1.84041559	3.255759935	2.406410632	3.473404817	1.024143099	3.219222716	2.155241835	0.888969159	2.25267403	1.657166672	1.872690077	1.105237768	1.345988686
fbn1	protein_coding	chrNC_030679.1:93845661-93969772:-	gi|512827448|ref|XP_002936615.2|	14414	0	PREDICTED: fibrillin-1 [Xenopus tropicalis]	gi|847111608|ref|XM_002936569.3|	10642	0	PREDICTED: Xenopus (Silurana) tropicalis fibrillin 1 (fbn1), mRNA	P98133	97.1	3.00E-18	Fibrillin-1	.	.	.	.	pfam00683	TB	TB domain. This domain is also known as the 8 cysteine domain. This family includes the hybrid domains. This cysteine rich repeat is found in TGF binding protein and fibrillin.	GO:0034199|activation of protein kinase A activity;GO:0009653|anatomical structure morphogenesis;GO:0042593|glucose homeostasis;GO:0006006|glucose metabolic process;GO:0010737|protein kinase A signaling;GO:0090287|regulation of cellular response to growth factor stimulus;	GO:0005576|extracellular region;GO:0005615|extracellular space;GO:0005622|intracellular;GO:0001527|microfibril;	GO:0005509|calcium ion binding;GO:0005201|extracellular matrix structural constituent;GO:0008201|heparin binding;GO:0005179|hormone activity;	K06825	FBN1; fibrillin 1	5.815399906	2.54862988	5.375196805	1.96989151	3.421863852	2.315280404	30.01522444	44.97909937	24.96849115	33.33392482	17.89486191	25.23494138	3.868305048	4.380626529	4.882205813	2.068240169	5.252427713	3.253905101	22.53868141	10.59651496	19.12386574	14.83948367	23.27011346	18.35400064	2.524955238	4.929594922	2.442113089	6.447803953	2.24226961	2.948808661	20.63941854	12.10750323	15.4885303	18.59418937	9.896583726	26.69795986	5.060467635	3.83045678	4.893494163	2.42732311	5.448805186	4.192334731	23.93302966	47.8010887	20.56966403	40.22736474	32.22133043	27.0626583
LOC100496716	protein_coding	chrNC_030683.1:74219445-74235579:+	gi|512853816|ref|XP_002942520.2|	1045	8.00E-129	PREDICTED: interleukin-18 [Xenopus tropicalis]	gi|847148398|ref|XM_002942474.3|	2671	0	PREDICTED: Xenopus (Silurana) tropicalis interleukin-18 (LOC100496716), mRNA	Q9TU73	60.1	1.00E-08	Interleukin-18	.	.	.	.	pfam00340	IL1	Interleukin-1 / 18. This family includes interleukin-1 and interleukin-18.	GO:0001525|angiogenesis;GO:0071222|cellular response to lipopolysaccharide;GO:0071407|cellular response to organic cyclic compound;GO:0006955|immune response;GO:0006954|inflammatory response;GO:0042095|interferon-gamma biosynthetic process;GO:0031663|lipopolysaccharide-mediated signaling pathway;GO:0000165|MAPK cascade;GO:0030101|natural killer cell activation;GO:0045662|negative regulation of myoblast differentiation;GO:0042104|positive regulation of activated T cell proliferation;GO:0010628|positive regulation of gene expression;GO:0032725|positive regulation of granulocyte macrophage colony-stimulating factor production;GO:0032729|positive regulation of interferon-gamma production;GO:0032740|positive regulation of interleukin-17 production;GO:0032819|positive regulation of natural killer cell proliferation;GO:0042346|positive regulation of NF-kappaB import into nucleus;GO:0051142|positive regulation of NK T cell proliferation;GO:0042088|T-helper 1 type immune response;	GO:0070062|extracellular exosome;GO:0005615|extracellular space;GO:0005622|intracellular;	GO:0005125|cytokine activity;	K05482	IL18, IL1F4; interleukin 18	3.598149869	3.689026773	3.23470328	5.219679581	1.757088298	2.543257052	1.323517058	1.974295297	1.625097854	1.784067579	0.708724066	1.265805283	6.023178346	4.114100324	3.725789571	4.365144363	3.444444456	1.197524446	1.563088031	4.434744091	1.325825705	1.83443008	1.234712967	1.839398264	5.208205849	15.21780199	10.04877963	3.791695807	4.405132891	11.34317095	2.675199058	1.783410232	2.725669861	1.787571974	2.039783447	2.531058847	5.893553249	3.379828363	3.913330188	2.470996477	3.169003144	2.545574052	1.58465957	1.11321914	1.536341207	1.712110703	1.23910674	1.920979232
olfml3	protein_coding	chrNC_030678.1:67665487-67675124:-	gi|118403662|ref|NP_001072318.1|	2182	0	olfactomedin-like protein 3 precursor [Xenopus tropicalis]	gi|847088505|ref|XM_012965130.1|	3399	0	PREDICTED: Xenopus (Silurana) tropicalis olfactomedin-like 3 (olfml3), transcript variant X1, mRNA	Q0V9V5	843	0	Olfactomedin-like protein 3	.	.	.	.	pfam02191	OLF	Olfactomedin-like domain.	GO:0007275|multicellular organism development;	GO:0005576|extracellular region;	.	.	.	3.658728577	2.334226372	5.919199823	2.877996533	3.705540879	1.470331517	46.07434873	102.0620421	34.11008727	114.1967898	81.89011573	53.64103392	4.543976025	5.314100349	3.496203038	2.199705365	5.534664586	2.260818855	39.4329473	17.14191607	37.34165062	25.24190716	44.11469451	60.15801929	2.615816037	6.701580213	2.577255066	4.584202961	3.275486678	3.921995835	50.14808256	24.65808839	31.50385647	43.46575358	20.74850446	69.18079168	4.902920885	2.950420223	5.228577459	2.417328517	7.876422151	5.58930932	36.91984341	71.78796661	47.24160118	66.34564433	52.54156375	41.24715088
